{
  "chairs": [
    {
      "available_windows": [
        [
          "06:00",
          "21:00"
        ]
      ],
      "chair_id": "C01",
      "station_type": "standard"
    },
    {
      "available_windows": [
        [
          "06:00",
          "21:00"
        ]
      ],
      "chair_id": "C02",
      "station_type": "standard"
    },
    {
      "available_windows": [
        [
          "06:00",
          "21:00"
        ]
      ],
      "chair_id": "C03",
      "station_type": "standard"
    },
    {
      "available_windows": [
        [
          "06:00",
          "21:00"
        ]
      ],
      "chair_id": "C04",
      "station_type": "standard"
    },
    {
      "available_windows": [
        [
          "06:00",
          "21:00"
        ]
      ],
      "chair_id": "C05",
      "station_type": "standard"
    },
    {
      "available_windows": [
        [
          "06:00",
          "21:00"
        ]
      ],
      "chair_id": "C06",
      "station_type": "standard"
    },
    {
      "available_windows": [
        [
          "06:00",
          "21:00"
        ]
      ],
      "chair_id": "C07",
      "station_type": "standard"
    },
    {
      "available_windows": [
        [
          "06:00",
          "21:00"
        ]
      ],
      "chair_id": "C08",
      "station_type": "standard"
    },
    {
      "available_windows": [
        [
          "06:00",
          "21:00"
        ]
      ],
      "chair_id": "C09",
      "station_type": "standard"
    },
    {
      "available_windows": [
        [
          "06:00",
          "21:00"
        ]
      ],
      "chair_id": "C10",
      "station_type": "standard"
    },
    {
      "available_windows": [
        [
          "06:00",
          "21:00"
        ]
      ],
      "chair_id": "C11",
      "station_type": "standard"
    },
    {
      "available_windows": [
        [
          "06:00",
          "21:00"
        ]
      ],
      "chair_id": "C12",
      "station_type": "isolation"
    }
  ],
  "close_time": "21:00",
  "generator": "c2r.synth v1",
  "name": "Harborline Dialysis Unit",
  "policy_text": "SYNTHETIC DATA \u2014 requires reviewer sign-off\n\n# Harborline Dialysis Unit \u2014 floor policy\n\nWe run three shifts a day on twelve chairs. Put-on windows are 06:00\u201306:45 for S1,\n10:45\u201311:30 for S2 and 15:30\u201316:15 for S3. The unit closes at 21:00 and nothing\nruns past that.\n\nStaff can only put on four patients in any fifteen-minute step of a shift. That is\nthe stagger, and it is a staffing limit, not a preference. A schedule that starts\nfive people in the same quarter hour is not one we can work.\n\nA chair needs thirty minutes of turnover between one patient coming off and the\nnext going on. That time is for cleaning and setup and cannot be shortened.\n\nWe never change a prescription. Treatment days stay MWF or TTS, and the session\nlength stays whatever the nephrologist wrote \u2014 210, 225, 240, 255 or 270 minutes.\nSessions are never shortened, split, or pushed to a different day to make a ride fit.\n\nPatients marked clinically fixed keep their start time exactly. The reason is on the\nchart and the front desk does not overrule it.\n\nPatients who have not consented to being moved keep their start time too. They can\nstill be given a better ride home; the chair simply does not move.\n\nA patient with a hypotension note needs thirty-five minutes of recovery after the\nsession instead of the usual twenty. Site hemostasis, post vitals and weigh-out all\nhappen inside that window, and the ride should not be at the door before it ends.\n\nWe accept at most four chair-start changes per shift per day, and no single change\nlarger than thirty minutes. Beyond that the floor cannot absorb it.\n\nAnything this policy does not allow goes to the charge nurse, not into the schedule.\n",
  "seed": 43,
  "shifts": [
    {
      "putton_end": "06:45",
      "putton_start": "06:00",
      "shift_id": "S1"
    },
    {
      "putton_end": "11:30",
      "putton_start": "10:45",
      "shift_id": "S2"
    },
    {
      "putton_end": "16:15",
      "putton_start": "15:30",
      "shift_id": "S3"
    }
  ],
  "stagger_cohort_size": 4,
  "stagger_step_min": 15,
  "synthetic": true,
  "turnover_min": 30,
  "unit_id": "U1"
}
